"Format for IDE '%1' is not supported","Format for IDE '%1' is not supported"
"Client side less compilation","Client side less compilation"
"Server side less compilation","Server side less compilation"
"Frontend Development Workflow","Frontend Development Workflow"
"Workflow type","Workflow type"
"Not available in production mode","Not available in production mode"
"Developer Client Restrictions","Developer Client Restrictions"
"Allowed IPs (comma separated)","Allowed IPs (comma separated)"
"Leave empty for access from any location.","Leave empty for access from any location."
